{
  "id": "v4",
  "title": "Fixture",
  "version": "0.1.0",
  "formatVersion": 1,
  "tileSize": 16,
  "screen": {
    "width": 160,
    "height": 160
  },
  "maps": [
    "map"
  ],
  "start": {
    "map": "map",
    "x": 1,
    "y": 1,
    "dir": "right"
  },
  "player": "hero",
  "plugins": [],
  "labels": {
    "continue": "Continue",
    "newGame": "New"
  },
  "state": {
    "flags": {
      "met": false
    },
    "vars": {
      "n": 0
    }
  }
}
