{
  "$schema": "../../schemas/game.schema.json",
  "id": "manor",
  "title": "빗소리 저택: 봉인된 약속",
  "version": "0.2.0",
  "formatVersion": 1,
  "screen": {
    "width": 480,
    "height": 270
  },
  "tileSize": 16,
  "maps": [
    "hall",
    "study",
    "library",
    "greenhouse"
  ],
  "start": {
    "map": "hall",
    "x": 18,
    "y": 18,
    "dir": "up"
  },
  "player": "investigator",
  "plugins": [
    "evidence",
    "lamps"
  ],
  "labels": {
    "continue": "조사 이어하기",
    "newGame": "새 조사 시작",
    "itemGet": "{name}을(를) 얻었다.",
    "menuItems": "아이템",
    "menuClues": "단서",
    "menuClose": "닫기",
    "menuEmpty": "아직 기록이 없다."
  },
  "state": {
    "flags": {
      "introduced": false,
      "met_steward": false,
      "met_archivist": false,
      "met_gardener": false,
      "trusted_archivist": false,
      "finished": false,
      "ending_truth": false,
      "ending_promise": false,
      "ending_accusation": false,
      "puzzle_solved": false
    },
    "vars": {
      "puzzle_result": 0
    }
  },
  "mapNames": {
    "hall": "현관홀",
    "study": "서재",
    "library": "도서실",
    "greenhouse": "온실"
  }
}
