{
  "id": "demo",
  "title": "작은 마을",
  "version": "0.1.0",
  "formatVersion": 1,
  "screen": {
    "width": 320,
    "height": 240
  },
  "tileSize": 16,
  "maps": [
    "village",
    "house"
  ],
  "start": {
    "map": "village",
    "x": 15,
    "y": 10,
    "dir": "down"
  },
  "player": "hero",
  "plugins": [
    "greetings"
  ],
  "labels": {
    "continue": "이어하기",
    "newGame": "처음부터"
  },
  "state": {
    "flags": {
      "met_elder": false,
      "visited_house": false,
      "rested": false
    },
    "vars": {
      "gold": 0,
      "greetings": 0
    }
  }
}
