{
  "id": "lantern",
  "title": "등대지기의 약속",
  "version": "0.1.0",
  "formatVersion": 1,
  "screen": {
    "width": 480,
    "height": 270
  },
  "tileSize": 16,
  "player": "sora",
  "plugins": [],
  "labels": {
    "continue": "이어하기",
    "newGame": "처음부터",
    "itemGet": "{name}을(를) 얻었다.",
    "menuItems": "아이템",
    "menuClues": "단서",
    "menuClose": "닫기",
    "menuEmpty": "아직 기록이 없다."
  },
  "state": {
    "flags": {
      "met_elder": false,
      "lamp_lit": false,
      "ending_public": false,
      "ending_kept": false
    },
    "vars": {
      "trust": 0
    }
  },
  "maps": [
    "pier",
    "tower",
    "garden"
  ],
  "start": {
    "map": "pier",
    "x": 3,
    "y": 6,
    "dir": "down"
  },
  "mapNames": {
    "pier": "선착장",
    "tower": "등대",
    "garden": "등대 뒤 마당"
  }
}
